{
  "schema_version": 1,
  "message_type": "ORDCHG",
  "release": "1.2",
  "source_document": "ORDCHG AHB 1.2 vom 01.04.2026",
  "pruefidentifikatoren": [
    {
      "code": 39000,
      "name": "Stornierung Sperr-/Entsperrauftrag",
      "segment_rules": [
        {
          "tag": "BGM",
          "requirement": "M"
        },
        {
          "tag": "DTM",
          "requirement": "M"
        },
        {
          "tag": "NAD",
          "requirement": "M"
        },
        {
          "tag": "RFF",
          "requirement": "M",
          "conditional_rules": [
            {
              "when_tag": "BGM",
              "when_element_index": 0,
              "when_value": "Z52",
              "then_requirement": "M",
              "then_qualifier_index": 0,
              "then_qualifier_value": "TN",
              "_description": "[3] Wenn BGM+Z52 (Entsperrung) vorhanden, ist RFF+TN (Transaktions-Referenznummer) Pflicht"
            }
          ]
        }
      ],
      "group_rules": []
    },
    {
      "code": 39001,
      "name": "Weiterleitung der Stornierung",
      "segment_rules": [
        {
          "tag": "BGM",
          "requirement": "M"
        },
        {
          "tag": "DTM",
          "requirement": "M"
        },
        {
          "tag": "NAD",
          "requirement": "M"
        },
        {
          "tag": "RFF",
          "requirement": "M",
          "conditional_rules": [
            {
              "when_tag": "BGM",
              "when_element_index": 0,
              "when_value": "Z52",
              "then_requirement": "M",
              "then_qualifier_index": 0,
              "then_qualifier_value": "TN",
              "_description": "[3] Wenn BGM+Z52 (Entsperrung) vorhanden, ist RFF+TN (Transaktions-Referenznummer) Pflicht"
            }
          ]
        }
      ],
      "group_rules": []
    },
    {
      "code": 39002,
      "name": "Stornierung der Bestellung von Werten",
      "segment_rules": [
        {
          "tag": "BGM",
          "requirement": "M"
        },
        {
          "tag": "DTM",
          "requirement": "M"
        },
        {
          "tag": "NAD",
          "requirement": "M"
        },
        {
          "tag": "RFF",
          "requirement": "M",
          "conditional_rules": [
            {
              "when_tag": "BGM",
              "when_element_index": 0,
              "when_value": "Z52",
              "then_requirement": "M",
              "then_qualifier_index": 0,
              "then_qualifier_value": "TN",
              "_description": "[3] Wenn BGM+Z52 (Entsperrung) vorhanden, ist RFF+TN (Transaktions-Referenznummer) Pflicht"
            }
          ]
        }
      ],
      "group_rules": []
    }
  ]
}
